,User_Id,Post_Description,likes,comments,labels,eng_score,engagement_score
263,Photo by Stephanie Sinclair @stephsinclairpix ," @tooyoungtowed. Baby, 17, and Claude, 48, of Freetown, Sierra Leone, were married during the Ebola crisis. Because of her small stature, Baby needed a cesarean section to safely give birth to their son, Joseph. This image was made #onassignment for @natgeo for a story called The Dangerous Lives of Girls. While child marriage is a critical issue in both crisis and stable contexts, the rates of girls married underage is rising at alarming rates in humanitarian settings according to @GirlsNotBrides. Today is the 7th annual International Day of the Girl Child. Poverty, violence, and cultural traditions oppress millions of girls in every part of the world. It is still a global struggle to have girls valued for more than their bodies ÛÓ for just their sexuality, fertility and labor. Today we come together to help galvanize support and inspire the international community to do its part to establish, expand and protect girlsÛª rights so girls are free to determine the course of their own lives. ItÛªs also a time to celebrate girls in every way, which is long overdue. #IDG2018 #dayofthegirl #tooyoungtowed #endchildmarriage #girls",219744,1760,"['plant', 'tree', 'outdoor recreation', 'adventure', 'geological phenomenon', 'recreation', 'rock', 'soil', 'fun', 'vacation']",0.06716655230505203,Low
264,Photo by @magnuswennman ," Commuters sleeping on the Tokyo subway. The Japanese term inemuri (sleeping while present) is a distinkt form of napping in wich a person dozes in a place not meant for sleep, such as the subway or at reastaurants. In Japan about 40 percent of the population sleeps less than six hours a night. Public dozing is socially accepted. For more images visit @magnuswennman :-)",367365,4808,"['land vehicle', 'transport', 'vehicle', 'public transport', 'standing', 'train', 'train station', 'rapid transit', 'metropolitan area', 'passenger']",0.12298773418323752,High
265,Photo by @maggiesteber ," This is Philomene, a young girl I photographed in the dry northwest town of Beauchamp, Haiti many years ago.  IÛªm posting her photograph to remember her and other young Haitian girls today on the International #DayoftheGirl. She was a student in a small local school. She told me she loved to read and that one day she hoped to be a nurse. I never saw her again after that visit but I think of her quite often because she so embodied the spirit and talent and the hopes and sense of possibility that all Haitians share and that is shared by young girls around the world.  I hope she accomplished her dreams. Like many developing nations, the literacy rate in Haiti is low and below the average for Latin American and Caribbean countries. Haiti faces shortages in educational supplies and qualified teachers where the rural population is less educated than the urban. A major earthquake in 2010 exacerbated an already difficult system by destroying infrastructure and displacing 50 to 90% of of students. Private education, which must be paid for, has substituted for education in public schools although the government has attempted initiatives to change this.  I tried very hard to help educate children in Haiti but the need was like a bottomless pit. In the world young women 15-29 are more than 3 times as likely as young men to not be in employment, education or training, according to UNICEF. Education can help change stereotypes we have held onto too long and take advantage of the talent and creative voices of girls to make a more vibrant and equitable world.  There are many organisations, ranging from public to private, that support and promote the education of girls around the world.  If you want to make the world a better place and safer for young women, please consider researching and supporting the education of girls and give them a voice.#dayofthegirl  #tooyoungtowed  #unicef #educategirls  #haiti  #education",170753,529,"['face', 'eyebrow', 'nose', 'forehead', 'chin', 'head', 'hairstyle', 'cheek', 'temple', 'lip']",0.04738255831403709,Low
266,"Photo by Stephanie Sinclair @stephsinclairpix // #sponsored by @OneSight // Debora Anodade Da Silva, 21, has her vision checked with an EyeNetra portable handheld phoropter, a lightweight instrument used to measure refractive error and determine eyeglass prescriptions. Da Silva is nearsighted, which means it is difficult for her to read or see anything at a distance. Currently more than a billion people worldwide need glasses, but have no way to get them. Taking their commitment to bring sight to the world, OneSight, an independent nonprofit, hosted their first-ever, fully digital, eye clinic in the Amazon. More than 2,000 patients traveled to the clinic during a five-day boat expedition to bring better vision to a remote and underserved area. Lack of access to good vision care is no small issue. It can create a cascading series of problems for individuals, families, and communities - starting in school, when students canÛªt see whatÛªs going on and have trouble reading. Uncorrected vision can have an impact on a persons employment prospects and even lead to social isolation. // Over a billion people across the world need glasses, but have no way to get them. In parts of the Amazon, people have to travel over 24 hours by boat to receive vision care. @OneSight found a way to reach them and provide more than clear sight. Watch todayÛªs story for more.",,107301,361,"['eyewear', 'sunglasses', 'glasses', 'vision care', 'hand', 'fun', 'product', 'nail', 'finger', 'girl']",0.029939038372103113,Low
267,Photo by Daniella Zalcman @dzalcman ," On Monday, the Cleveland Indians lost to the Houston Astros ÛÓ signaling the end of the team's controversial logo, Chief Wahoo. Starting next year, the Indians will remove his likeness from player uniforms and elsewhere in Progressive Field, though they will continue to sell Wahoo merchandise and memorabilia in their stores. This fan ÛÓ watching a game against the Chicago Cubs back in April ÛÓ is wearing a vintage jacket with a version of the Wahoo logo from the 1940s. The current iteration is just as much of a racist caricature: complete with tomato-red skin, an exaggerated hooked nose, and cartoonish grin.",195728,2103,"['sport venue', 'man', 'fan', 'stadium', 'structure', 'player', 'jersey', 'product', 'outerwear', 'competition event']",0.06289613005785996,Low
268,Photo by @mmuheisen (Muhammed Muheisen) ," Few months back I spent time on the worldÛªs only floating animal sanctuary while on assignment for @natgeo in Amsterdam, the Netherlands. De Poezenboot, which is Dutch for ÛÏthe CatboatÛ hosts around 50 stray and abandoned cats, 17 of which are permanent residents that have lived on the boat for several years. Day after day, you become part of their environment, you are just another big cat for them. For more photos and videos from different parts of the world, follow me @mmuheisen #muhammedmuheisen",383537,1171,"['reflection', 'water', 'waterway', 'night', 'tree', 'city', 'evening', 'street', 'screenshot', 'sky']",0.1063296527992591,High
269,Photo by @TimLaman ," A wild female orangutan in Borneo crosses a fallen tree making a natural bridge over a river.  This is a new camera trap shot I just got on my recent visit to Gunung Palung National Park in Indonesian Borneo.  I was there checking on my ongoing @NatGeo project to try to document the less well known nocturnal mammals.  But in this case, I captured an orangutan female instead, actually carrying a baby on her belly (that is hard to see except its orange fur) who was being chased by bees and came down to the ground.  If you look closely, you can see many bees around her.  Orangutans like to raid bee hives and eat the honey, but when they get swarmed by the bees, they often drop to the ground to try to make an escape and this female just happened to cross this log over the river where my remote camera was set up.  Follow me @TimLaman to see more animals that triggered my camera traps in BorneoÛªs rainforest.  #orangutan, @saveGPorangutans, @YayasanPalung, #GunungPalungNationalPark, #Kalimantan, #rainforest,#Borneo, #IndonesiaBiodiversity.",306895,928,"['fauna', 'wildlife', 'nature reserve', 'primate', 'jungle', 'terrestrial animal', 'organism', 'forest', 'rainforest', 'grass']",0.08503023985389803,Low
270,Photo by @edkashi ," A young man approaches a car in Jojug Marjanli, Azerbaijan on Oct. 21, 2017. This village is in the midst of a construction boom after liberation from Armenian occupation. Houses, schools, sports facilities, and more are being built in this significant location of land that separates Azerbaijani military from the Armenian occupied territories. This area was previously uninhabitable due to the conflict. @natgeo #travel #onassignment #abroad #azerbaijan #iran #border #onduty #edkashi #natgeo",143714,822,"['aviation', 'aircraft', 'air travel', 'sky']",0.04204023713114367,Low
271,Photo by @jimmy_chin ," @alexhonnold dropping in for another practice session on Freerider. It was an almost ten year dream and years of meticulous preparation that made AlexÛªs Free Solo of El Cap possible....and yes, an absurd amount of focus, determination and the capacity to manage fear like no other helped too. Shot on assignment for @natgeo during the filming of #FreeSolo. Û¢Free Solo expands into another 100 theaters across the country this weekend in cities including Seattle, San Francisco, Portland, Atlanta, Austin, Saint Louis and many others. 100% on Rotten Tomatoes! For more details check out www.freesolofilm.com or check the @natgeo stories.",381801,861,"['mountain', 'mountainous landforms', 'sky', 'ridge', 'geological phenomenon', 'adventure', 'atmosphere', 'cloud', 'terrain', 'mountaineer']",0.10410090848834293,High
272,"This pair of images by @BrianSkerry and W. H. Longley/Charles Martin can be purchased in the @natgeoimagecollection Flash Sale FROM THE ARCHIVES: THEN AND NOW for only $100 each. Shop the sale now until October 13th, 11:59 PM EST. Visit ngic.photos/NGFlashSale. . .Underwater exploration is at the core of National GeographicÛªs mission. One of the biggest challenges to tell the visual stories of the oceans and seas? Light. Noted marine biologist W. H. Longley and Charles Martin, director of National GeographicÛªs photographic lab, experimented for months in the 1920s with ways to capture images of fish. They eventually produced this image of a hogfish - the worldÛªs first underwater color photograph. Although camera equipment is far more advanced today, this lighting problem still exists. Brian Skerry has worked with National Geographic photo engineers to devise state-of-the-art camera housings and flash units to be able to capture ethereal scenes such as this whale shark swimming off the coast of Australia.",,306822,714,"['fish', 'marine biology', 'shark', 'cartilaginous fish', 'water', 'fish', 'organism', 'marine mammal', 'underwater', 'electric blue']",0.0837839811765871,Low
273,"Photos by @Hammond_Robin for @OneDayInMyWorld //ÛÏI will never forget what happened in Myanmar,Û says Rohingya refugee Mabia Khatun speaking of the ethnic cleansing perpetrated against her people. ÛÏSometimes it comes back to me - I feel unhappyÛ_ I canÛªt sleep and I have pain in my body. I get dizziness when I think about it.Û //Today, is #WorldMentalHealthDay. From anxiety to depression, schizophrenia to trauma (such as that which Mabia lives with) - one in four people will experience a mental health issue in his or her lifetime. Of all people living with a mental illness or an intellectual disability, 85% are in low and middle-income countries. Mental and behavioral problems reduce lifespan by as much as 20 years. In some countries, 98% receive no treatment. Neglect by governments and stigma leads to the marginalization of both the issue and the people living with mental health conditions.//I started documenting mental health issues in 2011. I founded the not for profit organization - @WitnessChange - to contribute to a world where mental health is recognized as a global health priority and a society where people living with mental health issues are seen, heard and valued. //To see more of the work from this series, follow @onedayinmyworld.",,201993,887,"['yellow', 'human', 'temple', 'religion', 'portrait', 'girl', 'abbess']",0.057549493485187016,Low
274,Photo by @tbfrost ," No, your eyes arenÛªt playing tricks on you, this is a two headed snake! A two headed copperhead to be specific. I was given permission to photograph this rare and incredible being by the Virginia Department of Game and Inland Fisheries. An x-Ray shows they share the same heart, digestive track, etc but have two completely in heads and thus brains. To see another photo of this two headed snake, IÛªm @tbfrost",661110,6344,"['reptile', 'scaled reptile', 'snake', 'fauna', 'serpent', 'boa constrictor', 'organism', 'macro photography', 'lizard', 'terrestrial animal']",0.2080895030820361,High
275,Photo by @katieorlinsky ," Fall time along the Alatna River in Gates of the Arctic National Park, Alaska. The Alatna River flows for roughly 184 river miles through the Brooks Range until it joins the Koyukuk River near the native village of Allakaket. It is known as one of the most beautiful rivers in the United States- which I can most certainly verify after spending the last few weeks backpacking, pack-rafting and photographing along 47 miles of the river. It was an incredible adventure, and an eye-opening look at some fascinating new ecological impacts that are transforming the landscape (thatÛªs all I can say about it now, but stay tuned for the upcoming article!).",406753,824,"['highland', 'wilderness', 'sky', 'mountain', 'loch', 'aerial photography', 'reflection', 'fell', 'tundra', 'photography']",0.11036935535690082,High
276,Photo by George Steinmetz @geosteinmetz ," A rare aerial view of Beni Isguen, the exquisitely preserved medieval city in the Algerian Sahara.  The pious non-Arabic muslim inhabitants donÛªt allow photography inside the fortified city walls, and visitors have to wander the narrow footpaths with a local escort to insure that rule is respected.  The rooftops are walled off to ensure privacy while sleeping outside in the cool night air. The triangular feature on the left is the town market. To see more of our world from above follow @geosteinmetz",295291,1106,"['wood', 'pattern']",0.08303723515765798,Low
277,Photo by @nicholesobecki ," ItÛªs been seven years since Silvana Hinestroza Mendoza first spoke publicly about being raped by members of a guerrilla group who kidnapped and tortured her when she was a young woman. More than 15,000 Colombian women and girls were raped or otherwise sexually abused during the countryÛªs civil war; many remain too terrified or ashamed to tell anyone. After spending most of a hot Wednesday afternoon with reporter @jillfilipovic recounting some of the most intimate details of the worst days of her life, Silvana retreated to her grandsonÛªs bedroom. Finally speaking the truth about what happened, Silvana said, feels good, even powerful ÛÒ like a layer of shame peeled back with each telling. But each telling also means exposing painful scars, literal and metaphorical. I photographed Silvana at that axis of strength and depletion, as she sought out the grounding weight of her grandsonÛªs small body, and offered him the soft foundation of her own. These are questions everywhere: whose stories we choose to believe, what weight we give a womanÛªs words against a manÛªs, whether women have exclusive jurisdiction over our own bodies. It is simultaneously dignifying and terrifying for women to tell the secrets more-powerful men demand we keep, and itÛªs never felt so important to listen, to believe, and to acknowledge the personal courage and integrity of the women who share their stories with us. ÛÏI feel light,Û Silvana said after our interview ended. ÛÏLike I was carrying something really heavy and I put it down.Û #believewomen #women #sexualassault #colombia",240989,1011,"['people', 'girl', 'child', 'fun', 'vacation']",0.0683888515349622,Low
278,Photo by @stephenwilkes ," Fire and Ice. This contrasted image was captured along the Coast Mountains in Bella Coola. To see more photos from my travels near and far, visit me @stephenwilkes.#DayToNight #StephenWilkes #BellaCoola #CoastMountains #Canada #Sunset #Mountaintop #Nature",325192,750,"['mountainous landforms', 'sky', 'mountain', 'mountain range', 'geological phenomenon', 'morning', 'ridge', 'rock', 'summit', 'alps']",0.0887615800023897,High
279,Photo by @CristinaMittermeier ," Fish is as valuable as gold.  Around the world, small coastal communities depend on healthy local fisheries for their survival.  In the West African village of Winneba, women toil with fish from morning to night, every day:  buying, smoking and selling fish in the local markets is the only way for them to make money.  I was proud to work with the local non-profit @ChallengingHeights to provide education and more opportunities for these women.  Headed by a former child slave, this small organization also rescues children who in desperation, have been sold by their parents into slavery to make a few dollars.  To learn more about the hopeful solutions taking place #Followme at @cristinamittermeier",148904,315,"['hand', 'finger', 'human', 'temple', 'fun']",0.040480540962255646,Low
280,Photo by @hammond_robin for @onedayinmyworld ,"ÛÏThe military were torturing people,Û says Fatima, mother of five year-old Yeasamin (in this photograph). Violence and flames, spread by the military, forced them to flee their village in Myanmar. Fatima saved Yeasamin from their burning house, but not before her leg and buttocks were badly burnt. The family eventually reached a refugee camp in Bangladesh where they found safety, but not peace. ""Mental illness"" does not translate into the Rohingya language. Instead they talk about a peaceful state of mind to express wellbeing. Un-peaceful minds are troubled, depressed, anxious, traumatized. Fatima expresses the trauma and stress in those terms too - ÛÏthere is no peace - we donÛªt have our own land, our own people, and our own country.Û// A year has passed since ÛÏethnic cleansingÛ perpetrated by the Myanmar military against the Rohingya sparked a massive refugee crisis. Nearly a million Rohingya ÛÒ those who escaped the flames and executions ÛÒ are now living in camps in Bangladesh. The physical scars have healed but deep trauma remains. // #inmyworld is designed to expose the challenges faced by people living with #mentalhealth issues and give them the chance to be seen, heard and valued. @witness_change is a nonprofit that aims to improve life for excluded groups by amplifying their stories. This work was made in collaboration with MÌ©decins Sans FrontiÌ¬res @doctorswithoutborders who provide mental health support to the refugees and local population. To see more or to share your own mental health story please follow @onedayinmyworld",260902,986,"['sitting', 'human behavior', 'temple', 'human', 'girl', 'fun', 'leisure', 'child', 'furniture']",0.07341736761272107,Low
281,Photo by @CarltonWard ," Just after sunset, Luke Fry drives past the milk barn to rake manure into fertilizer, one of the daily chores he and his twin brother Caleb do in the dark before and after school. On this night, Luke's girlfriend Rachel joins for the ride. This is the final image in a photo story I produced during the Missouri Photo Workshop. I applied wanting to reconnect with the fundamentals of photojournalism and push to develop a picture story around the lives of people I had never met in a place I didnÛªt know. After two years of chasing Florida panthers with camera traps nearly full time, it had become common for weeks to go by without holding a camera in my hands. So I set the high-tech equipment aside and went to Missouri with just one camera for an immersive experience that involved a lot of looking, listening and waiting. Each student was limited to just 400 photos for the week, with no deletions. When I am on assignment, I often shoot 1000 photos in a day. But the workshop leaders encouraged us to trust the process and to be intentional about the moments we tried to capture. By watching and waiting we would know when a moment was building and we should trust ourselves respond. By Wednesday evening I had watched the Fry brothers drive the tractor two previous times. But when I saw this sunset forming and heard the tractor coming on the third night, I started running down the hill, remembering the floodlights on the cab that could balance exposure with the western sky. Had I not been watching the farm work for two days, I wouldnÛªt have reacted when this moment presented itself. See the full story and inspiring work from other students through the link in my bio @carltonward. Thank you to my patient and insightful team leaders @billmarr and @wildhorsephotos and workshop leaders @kodakratz @davidreesphoto and Jim Curley. I can't wait to start incorporating lessons to my work in Florida. #MPW70 @mophotoworkshop",221832,509,"['tractor', 'agricultural machinery', 'vehicle', 'mode of transport', 'farm', 'field', 'rural area', 'agriculture', 'motor vehicle', 'tree']",0.06053432044817176,Low
282,Photo by @mmuheisen (Muhammed Muheisen) ," As the sun sets, people enjoy a swim in the Dead Sea in Jordan, on Saturday the 29th of September 2018. For more photos and videos from different parts of the world, follow me @mmuheisen #muhammedmuheisen",271433,504,"['sea', 'water', 'sky', 'ocean', 'horizon', 'water bird', 'calm', 'shore', 'sunset', 'bird']",0.07338823552611635,Low
283,Photo by @CristinaMittermeier ," In a high altitude African forest, a young mountain gorilla awakens from his afternoon nap to take a peek at me. These gorillas live in small family groups, and I spent the afternoon observing their playful behaviours, and gentle and loving nature. Protected by the Rwandan government, this gorilla population is a part of a thriving and well managed tourism industry that supports the local communities with whom they share their homeland. #FollowMe at @CristinaMittermeier for more photos of charismatic wildlife. #wild #nature #love #animals #photography",469528,2449,"['great ape', 'mammal', 'fauna', 'western gorilla', 'primate', 'terrestrial animal', 'wildlife', 'flora', 'organism', 'grass']",0.13599299676002344,High
284,Photo by David Chancellor @chancellordavid ," A gamekeepers apprentice extinguishing a patchwork of burning heather late into the evening, on Invermark, Cairngorm National Park, Scotland - Back in the Cairngorm National Park, Scotland for the muir burn - documenting a gamekeepers life - in this extraordinary landscape fire is still a commonly used and controversial agricultural tool, with farmers, crofters and gamekeepers burning grass, heather and gorse. In Scotland the season runs from 01 October through 15 April each year. Much of the heather burning we see today takes place on grouse moors such as those here in the Cairngorm National Park, Scotland. Here for generations gamekeepers have burnt long narrow strips of mature heather on a rotation. How often depends on how quickly the heather becomes both woody and unpalatable, and tall and unavailable. After 2/3 years young heather plants will have regenerated from seed or old stools that survived the fire. If the temperature of the burning is too high, or the grazing pressures are high, the critical balance of growth and competition allows fire and grazing-resistant grass species to become dominant, and the heathland is replaced. By creating a patchwork of different aged heathers a gamekeeper aims to have some young heather for grouse, sheep, deer and mountain hares that is nutritionally richer. Patches are burnt every eight to thirty years. To see more of a gamekeepers life in this extraordinarily complex environment, follow me here @chancellordavid @thephotosociety @everydayextinction and @natgeo #cairngormsnationalpark #scotland #agamekeeperslife",278573,445,"['wilderness', 'geological phenomenon', 'sky', 'mountain', 'wildfire', 'atmosphere', 'highland', 'ridge', 'cloud', 'terrain']",0.07490430036307667,Low
