,User_Id,Post_Description,likes,comments,labels,eng_score,engagement_score
168,Photo by David Chancellor @chancellordavid ," Samburu Lmuget, sasaab village, northern Kenya - I met Jeneria Lekilelei (centre of frame) over a decade ago now whilst sitting under a tree in northern Kenya. I was, IÛªll admit, pretty lost. What at first was a slightly nervous moment as this warrior simply came and sat next to me, has over the years developed into a deep respect both for the man and his work with @ewasolions in the Samburu, northern Kenya. The African lion population has declined by 43% in the last 20 years and lions now occupy only 8% of their historical range in Africa. The estimated numbers of lions across Africa are approximately 20,000. In Kenya, the national population now numbers less than 2,000 individuals. At current rates of decline, the species could become extinct here within the next two decades. This reduction in lion numbers is primarily due to habitat loss and conflict with humans, typically when lions kill peopleÛªs livestock. Lions and other large carnivores are wide-ranging species, and designated protected areas are often not large enough to ensure their long-term survival. It is crucial, therefore, that conservation of these species, as well as their prey, is addressed throughout the landscape, which not only incorporates protected areas, but also the surrounding areas where local people live. @ewasolions is dedicated to conserving lions and other large carnivores by promoting co-existence between people and wildlife, they work hand-in-hand with local communities to provide education, training and improved conservation practices that help people and wildlife, using sound science to help guide the long-term conservation of lions across community conservancies and protected areas in northern Kenya, and I love their work _ÙÔ_ÙÀ_ÙÔ_Ù__ÙÕ_to see more of it, follow me here @chancellordavid @thephotosociety @natgeo @everydayextinction @ewasolions #conserving #conservation #carnevores #northernkenya #kenya",250190,593,"['people', 'tribe', 'tourism', 'tradition', 'middle ages', 'travel', 'recreation', 'sand']",0.06838132861827466,Low
169,Photo by @chien_chi_chang ," I have been working in New YorkÛªs Chinatown since 1992ÛÓfor more than 26 yearsÛÓand it is still a project in progress. Immigration is often propelled by suffering. To witness the shifting patterns of populations is to see the world in all its exigenciesÛÓwar, natural disasters, repression, famine, poverty and persecution.But there is a rainbow at the bottom of that PandoraÛªs box of troubles; hope, too, propels immigrants to settle in strange lands. I should know: I am one myself. I have followed and photographed twenty families in Chinatown, and those relationships are now culminating in a tri-generational drama. The people in these pictures were all willing to sacrifice their immediate comfort to realize the dream of giving their children a ""better"" life. Some of that first wave of immigrants have now returned to China to enjoy the rest of their lives in prosperity, with family members they have not seen for decades. Others are trying to live the American dream.The common thread, the universal quality in this work, is the essential human need to hold hope in your hands. #MagnumPhotos #cccontheroad",129239,264,"['temple', 'darkness', 'night', 'girl', 'fun']",0.035080573413606264,Low
170,"Photo by @katieorlinsky // #sponsored by @t._rowe_price // I have been working in Alaska for close to five years, and even though a lot of that work includes following trails across thousands and thousands of miles, I have only explored a tiny fraction of the largest state. Yet somehow this photo feels as familiar to me as a snapshot of the Brooklyn Bridge. I often fly along this same route through these same mountains in the same bush plane. From way up high, I fantasize about how I would know exactly where I was if I found myself in the valleys thousands of feet below. The reality of course is that I have no idea what lies beneath me in the beautiful and brutal landscape of the Alaska Range, or for that matter the majority of Alaska's approximate 50 million square miles of wilderness. // T. Rowe Price goes beyond to gain an understanding of what lies beneath the surface of investment opportunities. Check out today's story to learn more and visit natgeo.com/gobeyond",,262637,486,"['sky', 'aerial photography', 'arctic', 'ice cap', 'fell', 'ice', 'geological phenomenon', 'glacial landform', 'mountain', 'highland']",0.07100046890731723,Low
171,Photo by Muhammed Muheisen @mmuheisen ," A group of unaccompanied refugee minors from Afghanistan sleep on the ground of a train platform at the railway station where they took shelter last year in Belgrade, Serbia. This image was part of my story Young and Stranded which was published in December issue of @natgeo Magazine. For more photos and videos of the refugee crisis follow me @mmuheisen, @everydayrefugees and @mmuheisenpublic  #everydayrefugees #muhammedmuheisen",184524,1319,"['urban area', 'wall', 'vehicle', 'car', 'tree', 'road', 'street', 'grass', 'recreation', 'plant']",0.05548990558490781,Low
172,Photo by Aaron Huey @argonautphoto ," Grand Gulch winds snake-like through 60 miles of sandstone on Cedar Mesa in #BearsEarsNationalMonument, Utah. Archeological finds in the Gulch reveal thousands of years of human habitation, primarily as the home to the Ancestral Pueblo people, and still contains many of the remains of their homes, kivas, and granaries. Concentrations were especially high in the Basketmaker II period starting in 500 BCE. To see some of the rock art left behind, and to hear interpretations of the stories they still tell today follow @argonautphoto.",349385,737,"['rock', 'geology', 'geological phenomenon', 'water', 'tree', 'sky', 'igneous rock', 'formation', 'bedrock', 'badlands']",0.09497053703289252,High
173,Photo by @beverlyjoubert , A ferocious snarl and a formidable reminder that a lioness is not to be underestimated. The dominant Duba Plains male wants to mate with her but she's having none of it and is letting him know in no uncertain terms. It's a process that can go on for some time. #lioness #bigcatsarenotpets #snarl #Okavangolions #nottoday,745975,2761,"['wildlife', 'lion', 'terrestrial animal', 'mammal', 'fauna', 'grassland', 'wilderness', 'grass', 'masai lion', 'big cats']",0.209582362568575,High
174,Photo by @TimLaman. ," A rain forest stream, Gunung Palung National Park.  This park in the Indonesian province of West Kalimantan, is one of IndonesiaÛªs treasures.  With what some say is the best remaining example of true lowland rainforest in all of Borneo, its biodiversity is extraordinary.  Along with my partners from BTNGP, @YayasangPalung @OneForest, and @saveGPorangutans, IÛªm working to document the biodiversity of this park that includes an extraordinary variety of forest types, from mangroves by the sea, through lowland dipterocarp forest like along this river, and up to the montane forest at the mountain summits.  Stay tuned to @TimLaman for a lot more from #GunungPalung. #GunungPalungNationalPark, #Indonesia, #Kalimantan, #rainforest, #Borneo, #IndonesiaBiodiversity",475621,1057,"['water', 'nature', 'vegetation', 'body of water', 'reflection', 'nature reserve', 'stream', 'ecosystem', 'tree', 'forest']",0.1295923203556456,High
175,Photo by @williamalbertallard ," South Dakota, 2006. The picture of hunters seen in their blaze orange garments, shotguns held aloft, just beyond the pickup truck in the foreground with a pheasant rooster lying still alongside a bale of straw, was not published in the essay I did called ""Hunters,"" published in the November, 2007 issue of National Geographic.  Both the magazine designer and I wanted this to be the lead picture but it lost out to another image of mine featuring hunters in a vast central Montana field rehabbed by the conservation group @pheasants_forever.  The beauty of the pheasant is apparent in even in death although the brilliance of its coloration I believe lessens in death.  When I was assigned to do the photography for this essay I really thought it would be popular with readers. I feared the recoil by those who might find killing a deer, such a graceful and docile animal, very distasteful if displayed in the magazine.  I could not have been more wrong.  The story ""Hunters"" received more mail than any other story published that year and response by readers was six to one positive.  I  believe the reason was very much influenced by the information given in the article about how hunting is part of the overall effort of conservation and managing wildlife in our country; from license fees wildlife refuges are helped to benefit bird watchers and those who simply enjoy the many areas set aside for wildlife habitat. #followme @williamalbertallard for more images of ""Hunters"" and other assignments spanning a five-decade career.@thephotosociety #hunter #pheasants #southdakota #pheasanthunting #birdhunting #blazeorange #onassingment",202796,2243,"['bird', 'recreation', 'water bird']",0.0655347679166816,Low
176,Photo by @stevewinterphoto ," Jaguars love the water - this male jag is looking for caiman for his dinner - shot in August in the Pantanal of Brazil. Our animal family is so much like us - they find mates, they have kids, they have to feed themselves and their families. If we can find a way to believe they think, feel and have emotions we will all be better humans. We need to treat them better and find a way to ensure their future on this planet. They are keystone species in their ecosystems, though we as humans are not.Jaguars are the 3rd largest of the big cats. Found from US / Mexico border to northern Argentina. Jaguars have rebounded in this area where 95% of the land is privately owned. In the past many ranchers would kill the cats when they ate their cattle. Today in this area tourism brings in much more money to the local economy than cattle ranching. So the jaguar population is increasing. But revenge killings of jaguars happen close to this area and all throughout the jaguars range. Also poaching for skins, bones and teeth is growing for the first time since the 1970Ûªs to feed the demand for people who think they receive the ÛÏpower of the jaguar through their teethÛ, Chinese Traditional Medicine and now Luxury items from endangered species. ÛÏWhen the buying stops, the killing can too.Û @wildaid My first story with big cats was the 1st @natgeo Jaguar story 20 years ago! It has changed my life working with the magical and magnificent cats of the world. Animals have emotions just like we have.Follow me @stevewinterphoto to see more images and THANKS!@stevewinterphoto @natgeo @nglive #nglive @natgeochannel @natgeowild @thephotosociety @natgeocreative @africanparksnetwork @jaguar #jaguar @pantanalsafaris",936331,2777,"['wildlife', 'jaguar', 'fauna', 'mammal', 'ecosystem', 'nature reserve', 'leopard', 'terrestrial animal', 'bank', 'beak']",0.25911422233702647,High
177,Photos by @gabrielegalimbertiphoto ," Do migrants have a past? Do migrants have a future? Or are they forever locked in the images of man on sinking boats, of women, babies in their arms, crawling under barbwire, of families waiting in line, stranded in the shadow of borders we thought had forever vanished? I have tried to see things differently. I have learned that these men and women actually had a job where they come from and dream of being able to work in Europe. So when I set out to photograph a group of migrants eager to reach Switzerland but blocked in the city of Como, in northern Italy, I decided to show them as they would have liked to be shown.  Dembo as a baker, Osman as a bus driver, Noreen as a nurse and Jafar as policeman. These are just some of works they are used to do and skilled in. But Dembo, Osman, Noreen, Jafar and many others are now living in lurid tents, camping out in a small park adjacent to the cityÛªs station in squalid conditions. These photos are their CVÛªs translated in images. I have borrowed the language of publicity to show what reportage cannot. These photographs are not totally real. But they should be. In order to illustrate the enormous chasm between their present and a possible future I have also done a series of still lifes of where the migrants actually sleep. ItÛªs in the space between these two worlds that the future of Europe will play out. /// You can find all the stories in my website www.gabrielegalimberti.com and instagram @gabrielegalimbertiphoto /// #migrant #migrants #job #jobs #future #cv #europe #borders #immigration #work #workingclassheroes",148472,638,"['food', 'cuisine', 'dish', 'flower', 'lunch', 'meal']",0.04222075829434119,Low
178,Photo by @PaulNicklen ," A pod of narwhals gathers at the surface for a quick breath before returning under the sea ice. These beautiful and elusive whales can be recognized by their unicorn-like tusk, which is used as a tool to hunt their primary prey: polar cod. Narwhals rely heavily on the presence of sea ice as the polar cod life cycle is completely tied to the ice. ItÛªs heartbreaking to realize the spiral of consequences associated with the impacts of climate change, especially as it relates to one of our oceans most majestic marine animals. From the Arctic to the Antarctic, the planet's polar regions are under threat from climate change. See some of my latest work on the Antarctic on the Nat Geo site. #narwhal #whale #arctic #climatechange",469275,1921,"['black and white', 'water', 'photography', 'monochrome photography', 'monochrome', 'sky', 'ice', 'freezing', 'rock', 'earth']",0.13289918478380056,High
179,Photo @tbfrost ," A green striped vine snake curled safely in the hands of @harry__turner, who found it during a night walk on conservation land along the Las Piedras river in the Western Amazon of Peru. The land is protected and studied by Peruvian non-profit  @hojanueva. This snake is not dangerous to humans as it is only mildly venomous (meaning the venom can kill frogs and other small creatures) and has rear fangs. The body is long and thin and flat, similiar to a ribbon. It spends most of its life in the trees and can extend about 2/3 of its body out to reach distant branches. Must have some seriously strong abs! If you want to see another photo of this snake, IÛªm @tbfrost",396378,1475,"['vertebrate', 'reptile', 'scaled reptile', 'close up', 'macro photography', 'finger', 'serpent', 'snake', 'nail', 'hand']",0.1114082263969996,High
180,Photo by Robbie Shone @shonephoto ," We set sail again, but this time a much shorter journey of just six hours. We left Ittoqqortoormiit and sailed west along Scoresbysund, where we saw these beautiful icebergs, some of which hidden in cloud. Then we headed north in Hurry Fjord to Constable Point, where we were to meet a helicopter to take us the last bit. It was sad to say goodbye to the boat, the SchwÌ¦rer family and the dream of sailing all the way to Wagener HalvÌü, but simply the fjords around the peninsula had not yet cleared of sea ice. @greenland_caves #EAGRE18",289343,466,"['iceberg', 'sea ice', 'arctic ocean', 'sea', 'sky', 'water', 'ice', 'ocean', 'calm', 'arctic']",0.07782196808347662,Low
181,Photo by @simoncroberts , Fracking for shale gas has just begun for the first time in the UK since it was linked with earthquakes in 2011. The practice of recovering gas and oil from shale rock has proved controversial with many protestors in Britain trying to halt exploration of new sites over the past few years. The village of Balcombe in Sussex has seen several confrontations between police and anti-fracking protesters with both local inhabitants and members of the Frack Off national movement opposing petroleum gas exploration plans. Here protestors in the Û÷No Dash for GasÛª Action Camp' can be seen trying to prevent a vehicle delivering apparatus to the Balcombe site back in 2013.Follow @simoncroberts to see more photographs from this series and other works. #simonroberts #merriealbion #britishlandscape #nodashforgas #ukfracking #balcombe #landscapestudiesofasmallisland,128900,459,"['crowd', 'public space', 'tree', 'plant', 'city', 'festival', 'recreation', 'street', 'public event', 'pedestrian']",0.036110859854545645,Low
182,Photo by @simonnorfolkstudio on assignment for an upcoming story for @natgeo ," The best thing about being back in Jerusalem is to experience again the Damascus Gate. Lens-like, it pulls in in Muslims from Salah e-Din Street, Orthodox Jews from Mea She'arim, Christian pilgrims from the hostels on the old Green Line and even the odd National Geographic photographer and squeezes them through this narrow gap in Suleiman the Magnificent's walls. It's like one of those technical drawings of how a jet engine works: it intakes these believers, fires them through grand architecture and ejects them at high energy through the nozzle of El Wad St and down into the Old City and its holy sites. Except instead of thrust it's an engine for producing piety. I think it is the most exciting, jinking left-turn right-turn in History.I'm rooming on the Via Dolorosa and I have my morning coffee to the sound of pilgrims from Romania or Nigeria or Korea, below my window, singing mournfully at the 8th Station of the Cross.Follow @simonnorfolkstudio  for updates, outtakes, unpublished and archive material.@natgeo @simonnorfolkstudio#photojournalism #documentaryphotography #simonnorfolk #jerusalem #christianity #religion #faith #holyland #orthodoxchurch #simonnorfolkstudio #igtravel #visualarchitects #pilgrims #faithful #traditions #culture #monks #viadolorosa #religious #religion #faith #belief #damascusgate #Suleiman #stationsofthecross",183060,1371,"['performing arts', 'event', 'performance', 'performance art', 'temple', 'opera']",0.05540789119114952,Low
183,Photo by @FransLanting ," The other night I had the great honor of receiving a Lifetime Achievement Award from @nhm_wpy, the Wildlife Photographer of the Year competition during a ceremony in LondonÛªs magnificent Natural History Museum. I was given a wonderful sculpture of a bull elephant. When my partner in life and work @ChristineEckstrom examined it closely, she realized it had been modeled after a photo I had made on assignment for @natgeo years ago of a famous elephant named ""Survivor"" in ZambiaÛªs North Luangwa Valley. Survivor lived through a previous poaching holocaust in the 1980s and he was written up in Mark and Delia Owens' books ""Eye of the Elephant"" and ""SurvivorÛªs Song."" The bull elephants depicted here, which I photographed in Botswana one memorable evening, lived more tranquil lives thanks to its governmentÛªs enlightened policy of putting a moratorium on elephant hunting, but even there the tide is turning. Nearly one hundred elephants were found poached in an area recently that had been a safe haven for years. IÛªm sharing this image in honor of all elephant champions including the late Paul Allen, and respectfully ask that you consider supporting the organizations that can turn the current poaching crisis around and secure a future for elephants. Follow me @FransLanting to learn more. @elephantcrisisfund @savetheelephants @wildaid @wildnetorg #elephants #elephantcrisisfund #ivory #nhm_wpy #conservation #wildlifephotography #wildlife.",958748,3640,"['elephants and mammoths', 'elephant', 'mammal', 'indian elephant', 'wildlife', 'african elephant', 'reflection', 'terrestrial animal', 'sky']",0.2698858048262935,High
184,Photo by @irablockphoto ," From the Charles Bridge, night falls on Prague Castle along the banks of the Vltava River in Prague. The castle dates back to the ninth century and is still in use today - as the office of the president of the Czech Republic. It is rumored to be the largest ancient castle in the world, occupying 750,00 square feet (70,000 square meters) and housing St Vitus Cathedral. #followme @irablockphoto to see more images from the world. #praguecastle #vltavariver #prague #czechrepublic #charlesbridge",410161,2440,"['sky', 'city', 'landmark', 'cityscape', 'town', 'reflection', 'tourist attraction', 'evening', 'dusk', 'skyline']",0.12052232255344486,High
185,Photo by @CristinaMittermeier ," As I prepare to dive into the water with over 1000 southern fur seals in the Falkland Islands, I'm hesitant, unsure of how the seals will react to my presence in their aquatic territory. However, within moments, I am surrounded, and my nerves fade away as they quickly reveal their playful nature. Nibbling and nudging at my scuba gear and camera, they are endlessly curious, and time slips aways as we enjoy a once in a lifetime visit together. #TurningTheTide #seal #nature #wildlifephotography",325861,719,"['water', 'underwater', 'fauna', 'marine biology', 'fish', 'organism', 'wildlife', 'marine mammal']",0.08875754935615797,High
186,Photo by @CristinaMittermeier ," Under the heavy rains of the African winter, I watched this southern ground hornbill and his mate make the best of the wet weather. As he made his way across the savannah, he stuffed his beak, stopping every few moments to catch a tasty frog or insect, content to have his beak spilling with frog legs. The couple eventually made their way into the forest, likely to drop off their abundant meal to their nest. #FollowMe at @CristinaMittermeier for some of my favourite images from around the world. #Kenya #nature #wildlife #photography",429204,2795,"['insect', 'beak', 'macro photography']",0.12750419401603624,High
187,Photo by @andreabruce ," In Peepli Kheera, India, girls line up for school where there is no working toilet. Most girls drop out of school when they start their period due to a lack of toilets and privacy. This happens in many parts of the world. India has been grappling with the problem since before it won independence from Great Britain in 1947. ÛÏSanitation is more important than independence,Û Mahatma Gandhi said, urging his compatriots to clean up their act. To some extent they have: The percentage of Indians who defecate in the open has declined substantially in recent decades. But with the population growing rapidly, census data suggest that most Indians now live in places where they are more exposed to othersÛª feces, not less. #india #sanitation @noorimages",178294,728,"['wall', 'tourism', 'historic site', 'archaeological site', 'temple', 'tourist attraction', 'arch', 'crowd', 'leisure']",0.05048241324206778,Low
188,Photo by @chien_chi_chang ," I have been working in New YorkÛªs Chinatown since 1992ÛÓfor more than 26 yearsÛÓand it is still a project in progress. Immigration is often propelled by suffering. To witness the shifting patterns of populations is to see the world in all its exigenciesÛÓwar, natural disasters, repression, famine, poverty and persecution.But there is a rainbow at the bottom of that PandoraÛªs box of troubles; hope, too, propels immigrants to settle in strange lands. I should know: I am one myself.",205804,575,"['food', 'dish', 'cuisine', 'meal', 'cook', 'chef', 'brunch', 'asian food', 'supper', 'taste']",0.056749970374548736,Low
189,Photo by @Hammond_Robin for @ICRC ," ÛÏIt was so long ago. Do you still think of him often?Û I asked Luzmila Mahuanca, an indigenous leader in Peru. The tears rolled down her cheeks - ÛÏYou always remember - a mother never forgets her children.Û LuzmilaÛªs 15-year-old son was taken away during the years of conflict between the military and the Shinning Path. He was never seen again. PeruÛªs Ashaninka communities like LuzmilaÛªs, which reside in the countryÛªs jungle regions, were devastated by the conflict. She has never stopped fighting for justice and answers about the disappearance of her son. She is not alone. An estimated 20,000 people are still missing.//Men make war; women live with the consequences. At least that is the way it is largely perceived. Women are hardly passive victims though. They grieve, they fight against the suffering, and many find they are forced to re-invent themselves, shedding an old identify and forging a new one shaped by war. //This work was made with the support of the International Committee of the Red Cross, a humanitarian organization working on all sides of conflict to alleviate peopleÛªs suffering. To see more from the A WomanÛªs War project, go to @ICRC",257089,627,"['flame', 'fire', 'darkness', 'light', 'smoke', 'sky', 'bonfire', 'atmosphere', 'night', 'computer wallpaper']",0.07036815869568967,Low
190,Photo by Aaron Huey @argonautphoto ," A hiker thinks twice before attempting to climb down old Moki steps (hand and foot holds carved into the near-vertical sandstone) once used to access these Ancestral living and storage structures in #BearsEarsNationalMonument, Utah.  The structures most likely date between 900-1250 CE. #MokiSteps can be found all over the American southwest.  With a potential fall of a couple hundred feet, this hiker chose not to enter the cave.  If you encounter any site like this please DO NOT ENTER it.  #VisitWithRespect Follow @argonautphoto to learn more about the Ancestral Pueblo people and to see more images that show how high up these dwellings are!",599119,1971,"['rock', 'soil', 'geology', 'cliff dwelling', 'formation', 'bedrock', 'fault', 'outcrop', 'wadi', 'archaeological site']",0.16690959266765698,High
