,User_Id,Post_Description,likes,comments,labels,eng_score,engagement_score
0,Photo by @stephenwilkes ," The water creates a surreal color landscape as the sun sets in Robson Bight.To see more photos from my travels near and far, visit me @stephenwilkes.#DayToNight #StephenWilkes #Abstraction #Water #Nature #Canada #Colorful",55694,196,"['blue', 'sky', 'water', 'reflection', 'atmosphere', 'daytime', 'line', 'calm', 'wave', 'computer wallpaper']",0.015589159147663515,Low
1,Photos by @richardbarnes ," After completing a photographic assignment at the California Academy of Sciences I was walking out of the African Hall when I noticed a painter on a Scaffold repainting a scene in a diorama that had been damaged by smoke from a fire that had recently occurred. I was struck by the strangeness of the scene of this beautiful surreal savannah with giraffe, wildebeest, etc. wrapped in protective plastic, juxtaposed with the painter amidst the tools of his trade. I received permission to return to photograph and this chance encounter led me on to the path to what would become my obsession with photographing Dioramas throughout the world in states of removal, restoration and often, sadly, destruction. There is a strange, some would say disturbing, irony, in going out into the wild and culling animals only to re-animate them to grace the halls of natural history museums. This work forms the basis of my photo series and book ""Animal Logic"".",102213,418,"['tree', 'wall', 'structure', 'arch', 'mural', 'painting', 'home', 'sky', 'plant', 'estate']",0.02894445793493968,Low
2,Photos by @laurentballesta ," How to meet a living legend? First learn everything from it, read everything, listen to everything. Tell yourself that it does not matter the chances of success. Then win the trust of Peter Timm, the first diver who, in 2000, saw through his mask the silhouette of """"the greatest zoological discovery of the twentieth century"""" Consider real risks, prepare for them, look at irrational fears, tame them. Finally mock that the quest may be impossible, just make it look beautiful and honest. And so in 2010, at a depth of 120 meters, at the first second of the first dive, we saw and photographed for the first time the fish from the bottom of the ages, the one that was thought to have disappeared 65 million years ago: """"Gombessa"""" the coelacanth.",348374,2163,"['blue', 'water', 'sea', 'underwater', 'ocean', 'sky', 'marine biology', 'atmosphere', 'sea turtle', 'calm']",0.10288612426819779,High
3,Photo by @CristinaMittermeier ," I met this Lisu man as he gathered gifts of the forest, in the Tibetan mountains of northwestern Yunnan in China. Here, each remote village has a sacred forest or ÛÏnongÛ where the people believe gods and ancestral spirits reside. Because of the forestÛªs spiritual nature, villagers are prohibited from harming it in any way, but they can collect fallen firewood, mushrooms, and medicinal plants. #FollowMe at @CristinaMittermeier for more of my photos from around the world. #enoughness #nature #photography",257808,614,"['plant', 'tree', 'organism', 'jungle', 'branch', 'forest']",0.07048034500959986,Low
4,Photo by David Chancellor @chancellordavid ," Golden eagle chick, Cairngorm National Park, Scotland - these guys are incredibly important to the ecosystem and yet many in the highlands see them as pests, as they take large numbers of grouse, rabbit, hare, and young deer. We climbed down to this nest towards the end of July accompanying the licensed ringer who weighed, measured and ringed both the chicks in this nest; and yes he is very much watching me, I was after all pretty much sharing his nest _Ù÷_ÙÕ__ü Both have now fledged and will compliment the biodiversity of this region. ItÛªs vital that estates here support these populations - to see more from here and elsewhere, follow me @chancellodavid @thephotosociety @everydayextinction",340355,893,"['beak', 'fauna', 'bird of prey', 'eagle', 'bird', 'organism', 'hawk', 'wildlife', 'accipitriformes', 'vulture']",0.09351989205458448,High
5,Photo by @simonnorfolkstudio ," Adanac Military Cemetery is a burial ground for those killed in the World War I. It's near the French villages of Miraumont, Pys and Courcelette. The cemetery was laid out after the Armistice of November 11, 1918, when graves were brought in from the battlefields around Courcelette and small cemeteries surrounding Miraumont. The cemetery was designed by Sir Herbert Baker and contains 3186 casualties of the war from the UK, Canada, Australia, New Zealand and South Africa.I've been working for a couple of years now on a project about the aftermath of the war. For more on this and other projects, follow me @simonnorfolkstudio#france #history #war #memorial #firstworldwar #1918 #memory #WW1 #somme #armistice #peace #cemetery #LestWeForget #cwgc #commonwealth #wardead #adnaccemetery #canada #Miraumont #Courcelette",166528,340,"['sky', 'landmark', 'memorial', 'historic site', 'architecture', 'tree', 'evening', 'monument', 'arch', 'mausoleum']",0.04520129992874731,Low
6,Photo by @salvarezphoto ," Chomolungma, as it is known in Tibet, rises like a giant pyramid of stone among the high peaks of Himalayas. Known in the west as Mount Everest, it is the tallest mountain in the world. The official height is 29,029 feet, but the mountain gains some height as the Indian land mass collides with Eurasia. The Himalayas are one of the best places to see the titanic forces of geology at work. Follow @salvarezphoto for more #Chomolungma #everest #aerial",292730,554,"['black and white', 'mountainous landforms', 'mountain', 'sky', 'cloud', 'monochrome photography', 'photography', 'mountain range', 'geological phenomenon', 'monochrome']",0.07920633826496218,Low
7,Photo by @melissafarlow ," Morning fog lifts and sun and shadows paint Keller Reservoir and the surrounding Pennsylvania woods. Water and forest health are connected, which is the emphasis of a growing number of managed programs in the region. @thephotosociety @thenatureconservancy #woodlands #forest #trees #lockhaven #pennsylvania",303821,559,"['reflection', 'nature', 'water', 'loch', 'lake', 'sky', 'wilderness', 'tarn', 'nature reserve', 'reservoir']",0.08211561686220885,Low
8,Photo by @amivitale ," Ntipiyon Nonguta and her son Bernard, one, relax with their neighbors as they make beaded belts for theLoisaba Community Trust in Ewaso Village in Laikipia, Kenya. These women are in a community surrounding Loisaba Conservancy (@loisaba_conservancy) and are being supported and given access to international markets. Revenue from ecotourism is reinvested into neighboring communities like #Ewaso.To get involved and learn more about community based conservation, please follow @loisaba_conservancy and @amivitale.@nature_org @natgeoimagecollection #kenya #magicalkenya #whyilovekenya #northernkenya #africa #children #mothersandsons #mothers #empowerment #conservation #everydayafrica #photojournalism #amivitale",208926,715,"['people', 'vertebrate', 'plant', 'tree', 'community', 'crowd', 'tribe', 'rural area', 'temple', 'recreation']",0.058363735725588395,Low
9,Photos by @ciriljazbec ," Bhutan is one of the world's remaining biodiversity hotspots. Fir trees create a dense cover in this forest. Approximately 72 percent of Bhutan is covered by forests. The country's government has a mandate that 60 percent will be protected for all time. Despite the government's environmental commitment, Bhutan's glaciers are retreating and melting, causing dangerous floods and resource scarcity. Hiking amidst these trees felt almost spiritual as if I encountered the Great Forest Spirit from the fantastic MiyazakiÛªs Princess Mononoke film. To discover more, follow the link in my @ciriljazbec profile.",434399,1403,"['tree', 'vegetation', 'forest', 'woody plant', 'woodland', 'ecosystem', 'old growth forest', 'branch', 'leaf', 'rainforest']",0.12087028509468217,High
10,Photos by @tasneemalsultan ," I recently attended the WWE's wrestling show in Saudi Arabia, the Crown Jewel Event in Riyadh, with many other women. I do not consider myself a fan just yet, but I will admit that it was a fun experience- the glitter pants were an added bonus. #riyadh #saudiarabia #WWE #crownjewel",106509,398,"['red', 'green', 'fun', 'magenta', 'art']",0.029945533162950434,Low
11,Photo by George Steinmetz @geosteinmetz ," Epic flying last week over the Pyramids of Giza.  I had tried for years, and was turned down even with Egyptian military helicopters.  Last week Egypt hosted the world paramotor championships, and suddenly the impossible happened.  This is me, the last one to land at sunset. For a rare view of the pyramids from above, go to @geosteinmetz",170640,528,"['air sports', 'paragliding', 'sand', 'landscape', 'ecoregion', 'desert', 'windsports', 'steppe', 'sahara', 'powered paragliding']",0.04734747441500911,Low
12,Photo by @irablockphoto ," A nighttime view from the top of the Old Town Bridge Tower of the Charles Bridge and Prague Castle along the banks of the Vltava River in Prague, Czech Republic. The Charles Bridge was constructed under King Charles IV of Bohemia starting in 1357 and was finished in the begging of the 15th century. The bridge is a very popular tourist destination especially at sunset and early evening when the city lights up. Prague Castle dates back to the ninth century and is still in use today - as the office of the president of the Czech Republic. It is rumored to be the largest ancient castle in the world, occupying 750,00 square feet (70,000 square meters) and housing St Vitus Cathedral. #followme @irablockphoto to see more images from the world.---#praguecastle #vltavariver #prague #czechrepublic #charlesbridge #kingcharlesIV #praguecatle",369737,2381,"['city', 'waterway', 'reflection', 'cityscape', 'sky', 'landmark', 'town', 'river', 'evening', 'tourist attraction']",0.10968485572285763,High
13,Photo by Michael Yamashita @yamashitaphoto ," High above the western Himalayas, meaning Û÷abode of snowÛª in Sanskrit, this massive mountain range contains some of the highest peaks on earth. It covers around 1,500 miles through the nations of India, Pakistan, Afghanistan, China, Bhutan, and Nepal.  #himalayanmountains #himalayas #snowcovered",487298,1059,"['mountain range', 'nunatak', 'mountainous landforms', 'massif', 'aerial photography', 'geological phenomenon', 'ridge', 'arte', 'glacial landform', 'sky']",0.13263659233175826,High
14,Photo by @PaulNicklen ," ItÛªs difficult to express what it is like to be in the company of an orca. I watch as it glides effortlessly through the blue ocean waters, and I feel totally at peace with this animal. But in this moment, thereÛªs not only one orca, there are many. A family on the hunt. Orcas have become one of the most demonized marine animals, and I am always trying to steer people away from this impression by capturing the beauty and intelligence of these complex cetaceans. Right now, I am back in Norway to shine a light on the importance of this keystone species and its associated ecosystem. #FollowMe at @PaulNicklen for photos from this expedition. #Norway #orcas #nature #ocean",508556,1818,"['marine mammal', 'water', 'marine biology', 'whales dolphins and porpoises', 'dolphin', 'killer whale', 'underwater', 'organism', 'spinner dolphin', 'short beaked common dolphin']",0.1425107099594529,High
15,Photo by @TimLaman ," This is the third highest peak on the worldÛªs second biggest island?  Know where this is? The island is New Guinea, a rugged, mountainous, rain forest covered island, second biggest in the world after Greenland and the biggest tropical island, and split between the countries of Papua New Guinea in the east, and the western half which is part of Indonesia, including the provinces of Papua and West Papua.  The peak is Peak Trikora, 4730 meters (15,580 ft) tall, and only a little less than Carstenz Pyramid, the highest peak on the island at 4884 meters (16023 ft), both of which are in the Indonesian half of the island.  Most people have no idea there are such big mountains on New Guinea so close to the equatorÛ_ the range of habitats created from the tropical lowlands to the alpine zone contributes to the incredible biodiversity of New Guinea.  #NewGuinea #Papua.  See more from this remote part of #Indonesia by following @TimLaman",288986,479,"['highland', 'mountain', 'sky', 'mountainous landforms', 'fell', 'ridge', 'hill', 'escarpment', 'atmosphere', 'terrain']",0.07780380200469492,Low
16,Photo by @michaelchristopherbrown ," Thousands of Jews visited the Cave of the Patriarchs, known to Muslims as the Ibrahimi Mosque, in the West Bank city of Hebron on September 25, during the Jewish holiday of Sukkot. Revered by both Jews and Muslims, the site is believed to be the oldest continuously used intact prayer structure in the world, containing the burial sites of the Patriarchs and Matriarchs of the Jewish People. The Arabic name of the complex reflects the prominence given to Abraham, revered by Muslims as a Quranic prophet and a patriarch through Ishmael. After the 1994 massacre of 29 Palestinian worshippers inside the mosque by Baruch Goldstein, an American-Israeli physician and religious extremist, Israeli authorities divided the mosque complex between Jewish and Muslim worshippers. Hebron is home to roughly 150,000 Palestinian Muslims and 700 Jewish settlers, the latter  living in a series of Jewish-only enclaves guarded by Israeli troops.",256309,3524,"['black and white', 'infrastructure', 'monochrome photography', 'photography', 'street', 'crowd', 'monochrome', 'temple', 'religion']",0.08677998772863996,Low
17,Photo by @nicholesobecki ," On a continent where natural resources have driven generations of boom and bust, Angola has a remarkable and frightening distinction. It is more dependent on commodity exports than just about any other nation in sub-Saharan Africa. Angola has long been repressive of independent journalists, and the opportunity to work there in 2016 was a rare chance to see the impact of the tremendous inequality that exists, from the glass skyscrapers soaring above the capital, Luanda, to this neighborhood overlooking Cabinda, a heavily guarded territory that accounts for half the oil output from the continentÛªs top petroleum producer. #oil #resourcecurse #angola #nicholesobecki",166891,314,"['urban area', 'city', 'tree', 'town', 'historic site', 'residential area', 'village', 'sky', 'neighbourhood', 'hill station']",0.045146468819652924,Low
18,Photo by @simoncroberts ," Visitors to the Ttukseom Hangang Park, an urban green space in Seoul, sit in the shade of a motorway overpass. Hangang, also known as the Han River, is the main body of water that runs through the middle of the capital city of South Korea. As in many cities, urban planners in Seoul have realized the significance of parks and green spaces to help combat issues of air pollution, improve public health, and to meet demands for increased leisure time.Follow @simoncroberts to see more photographs from this series and other works. #SimonRoberts #TtukseomPark #Hangang #SouthKorea #Seoul #urbanlandscapes  #urbanparks",166875,591,"['plant', 'structure', 'tree', 'recreation', 'leisure', 'park', 'city', 'tourist attraction', 'vehicle', 'crowd']",0.046730919614162425,Low
19,Photo by Charlie Hamilton James @chamiltonjames ," A lone male elephant reaches for fresh leaves in the branches in Gorongosa National Park, Mozambique, last week. We all know about the threats facing elephants and their decline in many parks across Africa. But in Gorongosa, elephant numbers are recovering. Years of civil war wiped out much of the park's wildlife, and poaching persisted until recently. However, increased security and investment into the park and the people who live in and around it have brought life back and now the park is thriving again. The story of Gorongosa will be featured in @natgeo magazine next year.",314465,1260,"['ecosystem', 'vegetation', 'tree', 'nature reserve', 'wilderness', 'wildlife', 'shrubland', 'fauna', 'woodland', 'forest']",0.08890038725616527,High
20,Photo by Robbie Shone @shonephoto ," 5 a.m. on the first morning on Wegener HalvÌü peninsula as sea fog rolls in over Nathorst Fjord. We continued our watches on land in 2.5-hour shifts, mostly observing musk oxex, though looking out for bigger furry white creatures too. It was a great opportunity for me to take photographs, though my partners were less enthusiastic at being awake in the middle of the night. Chris is seen here starting his watch, wandering off toward the cook/food tent to see what may be approaching in the midst. #EAGRE18 @greenland_caves",232449,370,"['sky', 'horizon', 'sea', 'calm', 'loch', 'morning', 'dawn', 'highland', 'atmosphere', 'sunrise']",0.06249464375820708,Low
21,Photo by Muhammed Muheisen @mmuheisen ," Meral, a 9-year-old Afghan refugee girl who dreams of becoming a queen. I portrayed Meral on November 5, 2018, in a camp north of Athens. For more photos and videos of the refugee crisis, follow me @mmuheisen @everydayrefugees and @mmuheisenpublic #muhammedmuheisen #everydayrefugees",458909,2110,"['beauty', 'human hair color', 'girl', 'hairstyle', 'eye', 'brown hair', 'long hair', 'black hair', 'model', 'portrait']",0.13129080435483614,High
22,Photo by @BrianSkerry ," A young harbor seal peeks at me over a mound of surf grass at Cortes Banks, a range of underwater mountains located 100 miles off the coast of San Diego, CA. This location, well known for stormy weather and giant waves, is a hotspot of biodiversity with an abundance of marine life found here. Places like this are oases of life in the sea, where each animal plays a role. Yet such places could easily be destroyed by a single fishing trawl net being dragged through it or by undersea drilling, and few would ever know it existed. Naturalist John Muir once said, """"When one tugs at a single thing in nature, he finds it attached to the rest of the world.Û Throughout my career of exploring our planet and especially the oceans, I have found this to be true: Everything is connected and every creature matters.Follow @BrianSkerry and visit the undersea world!#cortesbanks #johnmuir #california #marineprotection #seals #harborseal #seamounts",577753,2106,"['ecosystem', 'green', 'underwater', 'marine biology', 'fauna', 'organism', 'fish', 'seaweed', 'algae', 'water']",0.162134551548476,High
23,Photo by George Steinmetz @geosteinmetz ," Harvesting #cranberries on the bogs of the Gaynor Cranberry Farm. They flood them in late October and then rake the bogs with a buggy to float the berries to the surface. Some 97% of the berries will end up as dried craisins. #OceanSpray is a grower-owned co-op, where each member gets profit dividends according to the number of barrels delivered. The Dempzes have owned this farm for four generations, and helped me get off the ground by fixing the carburetor on my motorized paraglider! Farmers know how to fix stuff!To see more follow @geosteinmetz",266825,640,"['red', 'field', 'wood', 'line', 'sky', 'wood stain', 'ecoregion', 'angle', 'carpet', 'landscape']",0.07297139105102954,Low
24,Photo by @TimLaman ," A Buffy Fish Owl triggers my camera trap on a natural treefall over a river in BorneoÛªs Gunung Palung National Park. I currently have a set of camera traps operating in a remote part of this spectacular lowland rain forest for my latest @NatGeo Society project. Why? Gunung Palung has one of the best remaining lowland rain forests in all of Borneo, and I want to tell the story of the richness of the biodiversity there, especially the species few people get to see. IÛªm going out to Indonesia every few months, but in between, my team members from @saveGPorangutans and #TamanNasionalGunungPalung are monitoring my cameras and sending exciting reports from time to time about what we are getting. If you are curious about all of the equipment I use to get these shots, please take a look @TimLaman where I have shared a series of behind-the-scenes shots.  #cameratrap #owl #Indonesia #GunungPalung #Borneo",231127,650,"['fauna', 'bird', 'beak', 'wildlife', 'wood', 'organism', 'darkness', 'tree']",0.06375709960121935,Low
25,Photo by @edkashi , Scene from the Tarantsy River in Madagascar. Image made as part of the 2010 @Prix_Pictet Commission. Photo by @edkashi #edkashi #Madagascar #PrixPictet #fromthearchives #tbt #travel #onassignment #environment #sustainability #azafady,295194,669,"['reflection', 'water', 'sky', 'cattle like mammal', 'wildlife', 'tree', 'landscape', 'rock', 'bank', 'plant']",0.08050582892904115,Low
26,Photo by @PaulNicklen ," Every single dive is a different experience, and I am driven by the adrenaline that comes with exploring the mystery of our oceans. My encounter with this male orca in Norway was a highlight of my career. He swam within mere inches of me and kept disappearing into the dark water before racing toward me and faking me out again and again. He playfully reacted when I jerked my head back during one of his passes. I live for these kinds of interactions. To experience the personality and charisma of an apex predator on their terms. My team and I are back in Norway to continue where we left off in 2016, photographing these beautiful creatures. It is a privilege to share the water with them, and I hope to return with images and stories that will inspire and give justice to this species and their ecosystem. #FollowMe at @PaulNicklen for more photos of orcas and to follow along with this exciting expedition. #Norway #orca #ocean #underwaterphotography",390625,1346,"['water', 'marine mammal', 'marine biology', 'whales dolphins and porpoises', 'fin', 'azure', 'organism', 'underwater', 'whale', 'dolphin']",0.10917421158474888,High
27,Photo by Muhammed Muheisen @mmuheisen ," Kasumi doesnÛªt want her hair to be brushed. I was on the worldÛªs only floating animal sanctuary while on assignment for @natgeo in Amsterdam. De Poezenboot, which is Dutch for ÛÏthe CatboatÛ hosts around 50 stray and abandoned cats, 17 of which are permanent residents that have lived on the boat for several years. For more photos and videos from different parts of the world, follow me @mmuheisen and @mmuheisenpublic #muhammedmuheisen",223082,1582,"['cat', 'small to medium sized cats', 'cat like mammal', 'whiskers', 'kitten', 'fur', 'carnivoran']",0.0670126750577224,Low
28,Photo by Federico Rios @historiassencillas ," Two brothers rest together inside a crowded shelter for indigenous migrants constructed by the United Nations. Here the Warao can tie their hammocks. Within days of the shelterÛªs construction, more than 700 refugees arrived to occupy the space. Many spent days traversing Venezuela from north to south, finally reaching the border with Brazil. See more @historiasencillas and in the November issue of National Geographic Magazine. #refugees #Brazil #Venezuela",193227,478,"['hammock', 'leisure', 'fun', 'vacation', 'recreation']",0.052927117528039865,Low
29,Photo by @pedromcbride ," First Snow: There is nothing like the dance of the seasons. A grove of golden aspen trees is blanketed by an early fall dusting. To see more, follow @pedromcbride #fall #snow #nature #color #silence",335365,621,"['vegetation', 'wilderness', 'geological phenomenon', 'wildflower', 'winter', 'sky', 'frost', 'morning', 'geology', 'tundra']",0.09066393608698034,High
30,Photo by @ladzinski ," Relics from a century ago, whale bones decorate the pebbly shores on a remote island in the #Antarctic Peninsula, a haunting reminder of the excessive hunting during the whaling years. Walking around the iceless scene here was equally as shocking to me as I looked around at the evidence humans had left behind. The big melt, itÛªs happening. Photographed on assignment for @natgeo, please take the time to read the story in this month's issue written by @craigwelch to learn how deeply Antarctica is being affected. @sea_legacy @paulnicklen @cristinamittermeier @andy_mann",326206,614,"['rock', 'sky', 'badlands', 'geological phenomenon', 'mountain', 'formation', 'landscape', 'geology', 'national park', 'stock photography']",0.0882449749607587,High
31,Phone photo by @gabrielegalimbertiphoto ," Castiglion Fiorentino, Italy, my hometown. It's always nice to come here for a few days and spend time with family and friends after weeks of traveling while on assignment for National Geographic. Tuscany is a perfect place to recharge and prepare for the next project. #tuscany #italy #home #hill #hills #green #nature #fog #morninglight",292273,602,"['sky', 'cloud', 'mountainous landforms', 'highland', 'mountain', 'hill', 'hill station', 'tree', 'morning', 'rural area']",0.07936292618407674,Low
32,Photo by @renan_ozturk ," Figures on a landscape. One of the things I love about climbing is the community and inclusiveness within it. This is where it all started for me, and I was taken in by the tribe, and the place I come back to in order to check in and grow. This past trip was all about giving that back to others with new experiences like new desert crack climbers. In the spirit of our lost friends Micah, Dean, Bean, Stanley, Johnny, Hayden, we rage on, burning every moment of each day with wonder and gratitude. Follow @renan_ozturk for more images from the climbing life.",403073,800,"['rock', 'sky', 'badlands', 'geological phenomenon', 'mountain', 'formation', 'geology', 'landscape', 'terrain', 'national park']",0.10927592855480274,High
