,User_Id,Post_Description,likes,comments,labels,eng_score,engagement_score
87,Photo by Federico Rios @historiassencillas ," As the number of migrants from Venezuela to Brazil grows, government shelters have provided temporary housing for more than 700 Warao. Shelters offer a place to sleep, food and basic medical care. Inside this camp in the border city of Pacaraima, the shelters are full, so newly arriving migrants have to sleep on the streets or continue their migration further south to Boa Vista, Brazil. See more photos @historiassencillas and in the November issue of National Geographic Magazine. #Brazil #Venezuela #refugees",143957,644,"['structure', 'sport venue', 'crowd', 'recreation', 'city']",0.04108251284590596,Low
88,Photo by @stephenwilkes. ," Captivated by this painterly scene of autumn in Bella Coola.To see more photos from my travels near and far, visit me @stephenwilkes.#DayToNight #StephenWilkes #BellaCoola #Canada #CoastMountains #Fallfoliage #Aerial",469479,940,"['nature', 'wilderness', 'nature reserve', 'mount scenery', 'ecosystem', 'mountainous landforms', 'mountain', 'highland', 'sky', 'valley']",0.12732609324250627,High
89,Photo by @dguttenfelder ," On a small patch of land under a highway overpass in western Tokyo, Katsuo Takeuchi threshes his familyÛªs rice. On assignment for @natgeo in #Tokyo.",228355,430,"['field', 'farm', 'agriculture', 'rural area', 'plant', 'harvest', 'tree', 'grass', 'grass family', 'hay']",0.061775434504340775,Low
90,Photo by @markosian ," Doud rests at a local pool in Wolfsburg, Germany. The 10-year-old is a refugee from Iraq who arrived to Germany in 2015. He is now among a group of refugees who are learning to swim as a way of overcoming their fear of water and the journey they made.",302862,955,"['yellow', 'reflection', 'darkness', 'light', 'photography', 'lighting', 'night', 'water', 'sky', 'fun']",0.08413761743248688,Low
91,Photo @tbfrost ," When forests are cut and burned, slow-moving creatures, especially reptiles, often are caught in the fires and burned alive. In this photo @harry__turner is holding the remains of an 8-foot red tail boa constrictor we found on the edge of a forest that had been in flames just days before. Smoke was rising from the earth and the ground was still hot to the touch. There was no color, just black and grey. The scene suggested the snake had slithered as fast as possible to make it to the river, but that the burns to over half its body overwhelmed it, and the beautiful creature died just a few feet from safety. The sadness amongst us was such that one could feel it in the air. The hardest part wasnÛªt that they died but how they died. In one hour of searching a football field-sized clearing, @harry__turner, @melissalesh, and I found 4 dead snakes, 4 dead yellow footed tortoises, dozens of lizards and rodents, and hundreds of insects. The loss of rainforest alone gives all of us, including me, good reason to think more carefully about the sources of the things we buy. But knowing so many animals meet their end like this has renewed my vigilance to be a more careful consumer. Head on over to @tbfrost to see a happier photograph of this same species of boa alive and well, living in a national park. #snakes #snakesofinstagram #rainforest #peru #snek #fires #deforestation #reptiles",538774,6869,"['tree', 'scaled reptile', 'reptile', 'jungle', 'forest']",0.17932675467482218,High
92,Photo by @beverlyjoubert ," It looks like a snarl, but it is in fact a response to pheromones known as the """"flehmen"""" response. This is seen in a number of mammals and most cats (including house cats), and allows them to check the reproductive or territorial status of others. Both males and females will bare their teeth like this when they come across a scent that gives them a chemical signal. This dominant male is testing the pheromones in the urine of a female who is coming into estrus and, after sensing her readiness, will track her very closely. Follow @beverlyjoubert for more on big cats and African wildlife #BigCats #Flehmen #ThisIsMyTrophy #FelineCanines",481500,1308,"['wildlife', 'lion', 'mammal', 'fauna', 'roar', 'masai lion', 'mane', 'snout', 'close up', 'terrestrial animal']",0.13255873545744443,High
93,Photo by Moises Saman @moisessaman ," Salvadorian migrants arrive in the Guatemalan border town of Tecun Uman, along the Guatemala-Mexico border, after walking for a day from San Salvador. The caravan of migrants spent one night in Tecun Uman, where they rested, were fed by donations from the townspeople and local and international NGOÛªs, and charged their mobile phones before crossing the border into Mexico and continuing their journey toward the United Sates. The caravan of migrants left San Salvador on Oct. 31, 2018 and is determined to reach the United States. Shot on assignment for National Geographic. @magnumphotos",160936,1008,"['black and white', 'infrastructure', 'monochrome photography', 'street', 'snapshot', 'car', 'photography', 'monochrome', 'vehicle', 'road']",0.04757992850353113,Low
94,Photos by @maggiesteber ," In the historic cemetery of the town of Atzompa, Mexico, a young woman lights a candle to a loved one after cleaning and decorating the gravesite with traditional cempasuchils, known as the Flor de Muerto, during MexicoÛªs Day of the Dead celebrations. On this national holiday Mexicans sit around grave sites covered with flowers and candles, burning copal and drinking mescal as they tell old stories about loved ones who have passed.  Families share mescal and coffee and sing or play instruments until the sun comes up and shoots across the cemetery and then pack up and go home to continue the celebrations of the spirits who have passed. The families cook and eat the food favored by the deceased and build altars to them called ofrendas in their homes. Day of the Dead is celebrated from October 31 through November 2. The cemetery in the small town of Atzompa, five kilometers outside of Oaxaca de Juarez, is one of the loveliest in the state of Oaxaca. The holiday focuses on supporting the spiritual journeys of loved ones who have passed. Celebrations include festivals where people paint their faces and dress in costumes to dance and march to multiple parades that go on during the days and well into the nights. Scholars trace the origins of the modern Mexican holiday to indigenous observances dating back hundreds of years and to an Aztec festival dedicated to the goddess Mictecacihuatl.  #dayofthedead #mexico #atzompa #family #tradition",257270,673,"['night', 'light', 'darkness', 'event', 'lighting', 'tradition', 'tree', 'fte', 'christmas lights', 'ceremony']",0.07067898070390581,Low
95,Photo by @lynseyaddario ," I photographed women in Afghanistan, which has one of the highest rates of maternal mortality in the world for my @natgeo story Û÷Veiled RebellionÛª. Pictured above, Noor Nisa, eighteen (right), was in labor and stranded with her mother in Badakhshan Province, Afghanistan, November 2009. Her husbandÛªs first wife died during childbirth, so he was determined to get her to the hospital, a four-hour drive from their village. His borrowed car broke down and I ended up taking them to the hospital, where Noor Nisa delivered a baby girl.  #photojournalism #itswhatido #lynseyaddario",271717,1013,"['sky', 'ecosystem', 'cloud', 'rock', 'photography', 'sand', 'landscape', 'mountain', 'ecoregion', 'hill']",0.07638113317801724,Low
96,Photo by @stevewinterphoto ," Jaguars love the water. This male jag is looking for caiman for her dinnerÛÓwhile a female waits on the bank. Shot in August in the Pantanal of Brazil.Our animal family is so much like us: They find mates, they have kids, they have to feed themselves and their families. If we can find a way to believe they think, feel, and have emotions, we will all be better humans. We need to treat them better and find a way to ensure their future on this planet. They are keystone species in their ecosystems, though we as humans are not.Jaguars are the third largest of the big cats. They are found from the U.S./Mexico border to northern Argentina. Jaguars have rebounded in Brazil's Patanal, where 95% of the land is privately owned. In the past many ranchers would kill the cats when they ate their cattle. Today in this area tourism brings in much more money to the local economy than cattle ranching. So the jaguar population is increasing. But revenge killings of jaguars happen close to this area and all throughout the jaguar's range. Poaching for skins, bones, and teeth is also growing for the first time since the 1970s to feed the demand of people who think they receive the ÛÏpower of the jaguar through their teeth,Û Chinese traditional medicine, and now luxury items from endangered species. ÛÏWhen the buying stops, the killing can too.Û @wildaid My first story with big cats was the first @natgeo jaguar story 20 years ago! It has changed my life working with the magical and magnificent cats of the world. Animals have emotions just like we have.Follow me @stevewinterphoto to see more images and THANKS!@stevewinterphoto @natgeo @nglive #nglive @natgeochannel @natgeowild @thephotosociety @natgeocreative @africanparksnetwork @jaguar #jaguar @pantanalsafaris  #rightplacerighttime #naturalworldsafaris",703269,1778,"['jaguar', 'leopard', 'terrestrial animal', 'wildlife', 'mammal', 'fauna', 'big cats', 'cheetah', 'organism', 'cat like mammal']",0.19285302666506696,High
97,Photo by @dguttenfelder , An early morning view of Pyongyang along the banks of the Taedong River in September 2018.,285845,428,"['waterway', 'sky', 'reflection', 'dawn', 'horizon', 'river', 'sunrise', 'morning', 'dusk', 'atmosphere']",0.07669552054793344,Low
98,Photo by Michaela Skovranova @mishkusk ," Green turtles are thought to live for up to 80 years. What a different ocean that would have been when they dipped their head underwater for the first time. Like other sea turtles, the females return to the very same beach on which they were hatched to lay their eggs, often covering hundreds of kilometers in the process. This photograph showcases a young green turtle that has been successfully released back into the wild with a temporary satellite tracker attached. The tracker will collect valuable information that will allow researchers to track where the turtles are, the route they have traveled, and how fast they may be moving. #ocean #turtle #shellybeach #australia #sydney #nature #wildlife #marinesanctuary #naturelovestories",293625,474,"['underwater', 'turtle', 'sea turtle', 'marine biology', 'reef', 'sea', 'loggerhead', 'organism', 'coral reef']",0.0789799883206289,Low
99,Photos by @gabrielegalimbertiphoto ," Do migrants have a past? Do migrants have a future? Or are they forever locked in the images of man on sinking boats, of women, babies in their arms, crawling under barbwire, of families waiting in line, stranded in the shadow of borders we thought had forever vanished? I have tried to see things differently. I have learned that these men and women actually had jobs where they come from and now dream of being able to work in Europe. So when I set out to photograph a group of migrants eager to reach Switzerland but blocked in the city of Como, in northern Italy, I decided to show them as they would have liked to be shown. Dembo as a baker, Osman as a bus driver, Noreen as a nurse, and Jafar as a policeman. These are just some of jobs they used to do and are skilled in. But Dembo, Osman, Noreen, Jafar, and many others are now living in lurid tents, camping out in a small park adjacent to the cityÛªs station in squalid conditions. These photos are their CVs translated in images. I have borrowed the language of publicity to show what reportage cannot. These photographs are not totally real. But they should be. In order to illustrate the enormous chasm between their present and a possible future, I have also done a series of still lifes of where the migrants actually sleep. ItÛªs in the space between these two worlds that the future of Europe will play out. You can find all the stories in my website www.gabrielegalimberti.com and Instagram @gabrielegalimbertiphoto #migrant #migrants #job #jobs #future #cv #europe #borders #immigration #italy #salvini #matteosalvini #work #workingclassheroes",177260,802,"['bus', 'vehicle', 'transport', 'mode of transport', 'motor vehicle', 'tour bus service', 'automotive exterior', 'commercial vehicle', 'public transport']",0.05063825124730021,Low
100,Photo by Pete McBride @pedromcbride ," Silence is more memorable than the views. ÛÏThe brush of bat wings in the morning over your head. The clatter of sheep hooves on the rock across the river. It sounds as if itÛªs close by, but itÛªs not,Û says McBride. ÛÏAnd then you realize just how quickly that silence can be shattered."" From a recent @natgeo story on my Grand Canyon project. To read more or learn more, follow @pedromcbride #grandcanyon #betweenriverandrim #silence #humility #petemcbride",478444,965,"['sky', 'badlands', 'wilderness', 'cloud', 'horizon', 'geological phenomenon', 'national park', 'atmosphere', 'rock', 'canyon']",0.12979789857370033,High
101,Photo by @nicholesobecki ," Wooden carts drawn by donkeys rattle along the streets of Hawassa, an Ethiopian city in the Great Rift Valley. I came across this scene while working on a story about EthiopiaÛªs emerging manufacturing industry ÛÓ a growing economic space in a country where more than three-quarters of the workforce is engaged in small-scale agriculture. Taken just blocks away from the  sprawling Hawassa Industrial Park, this image felt outside of time and made me think of how ones traditions coexist alongside the drive for change. #ethiopia #economy #manufacturing #industry #tradition #nicholesobecki",194945,425,"['tree', 'morning', 'sunlight', 'light', 'sky', 'path', 'photography', 'rural area', 'evening', 'grass']",0.05306936687993083,Low
102,Photos by Stephen Alvarez @salvarezphoto , Morning in the Vienna Museum of Natural History. This morning I arrived early for a visit at the Museum of Natural History. I love being in a Museum before it opens while the staff is still working. The collections at the Museum are amazing but what impressed me most was the grandeur of the building itself and of course the Venus (Woman) of Willendorf. Head to the @ancientartarchive for a longer discussion of her. #Vienna,285157,1199,"['landmark', 'arch', 'tourist attraction', 'building', 'window', 'arcade', 'column', 'facade', 'symmetry', 'city']",0.0809385468452776,Low
103,Photo by Michael Yamashita @yamashitaphoto , Naruko Gorge is one of Japan's best places to see fall colors. #narukogorge #Miyagi #Japan #autumn,468058,1124,"['nature', 'autumn', 'leaf', 'tree', 'woody plant', 'vegetation', 'deciduous', 'maple tree', 'woodland', 'temperate broadleaf and mixed forest']",0.12801227242357344,High
104,Photo by @PaulNicklen ," While photographing at Cooper Bay in Antarctica, I managed to capture this shot of a macaroni penguinÛªs eye. Although they live in frigid snow and ice, their eyes are a fiery red. These penguins are full of energy and spunk and are distinguishable by the ÛÏVÛ shaped yellow crest located on the centre of their forehead which extends towards the back of their head. #FollowMe on @PaulNicklen for more photos from the Antarctic and check out @natgeo magazine's November issue for my most recent work in this polar paradise. #penguins #wildlifephotography #explore #Antarctica",429509,1926,"['red', 'close up', 'eye', 'macro photography', 'iris', 'circle', 'computer wallpaper']",0.12259965924311796,High
105,Photo by @dguttenfelder ," North Korean women play traditional instruments and drums on the field of the May Day Stadium in September 2018, during a debut of a new ""Mass Games"" event to mark the 70th anniversary of the founding of the nation. In the stands of the stadium, citizens use colored cards to create a giant mosaic depicting the city of Pyongyang.",272939,850,"['sport venue', 'structure', 'stadium', 'crowd', 'grass', 'sky', 'arena', 'world']",0.0757637047031937,Low
106,Photo by @pedromcbride ," Celebrating Peace: I recently witnessed a remarkable event in northern Kenya where five tribes that have historically fought against each otherÛÓput their differences aside and dancedÛÓtogether. Led entirely by women with @nrt_kenya this peace meeting was the first of its kind and a message for young and old men, and women alike to work together to protect their world and the natural world that sustains them, including wildlife, water and grasslands. Under the glow of car lights, these pastoral women danced into the night, all singing traditional songs and creating new ones. @usaid #inspired #hope #kenya #africa #dance #peace  #petemcbride",224563,524,"['tradition', 'carnival', 'festival', 'temple', 'ritual', 'event', 'fte', 'computer wallpaper', 'religion']",0.06132965341865538,Low
107,Photo by Muhammed Muheisen @mmuheisen ," ""I want what every mother wants, to raise her children in a safe placeÛ. Narmeen, a Syrian refugee mother whom I photographed last July at the informal extension of Moria camp in the Greek Island of Lesbos. Narmeen's image is part of my exhibition ""Light on the Move"", a selection of images showing the daily life and the challenges refugees face. The exhibition is currently displayed at Museum of Cycladic Art in Athens, organized by @iomgreece. For more photos and videos of the refugee crisis follow me @mmuheisen @everydayrefugees and @mmuheisenpublic #everydayrefugees #muhammedmuheisen",182832,809,"['tree', 'plant', 'waste', 'grass', 'vehicle']",0.05212558092764907,Low
108,Photos by @CarltonWard ," Brothers Blevyns and Andre Jumper work in the cow pens at the Seminole Tribe of Florida's Big Cypress Reservation. Seminoles have been ranching in Florida since the early 1700s when they were still identified as Creeks. Cow work remains an important part of Seminole culture today and the tribe is one of the top ten cattle producers in the United States. Blev (foreground) and Dre (on his horse in the second photo), work alongside their sisters, father, mother and grandparents to keep their heritage alive. Cattle ranches in Florida protect millions of acres of land from development and provide important connections in the statewide Florida Wildlife Corridor. The first cattle and horses in the United States arrived to Florida in 1521 and can be a natural fit in historic grasslands and prairies that evolved with herds of herbivores, such as in the Northern Everglades. For more #HiddenWild, please follow @CarltonWard. #Seminole #NativePride #Ranch #Cattle #FloridaWild #KeepFLWild #Everglades @FL_WildCorridor @NatGeoImageCollection @ILCP_photographers",157553,409,"['construction worker', 'blue collar worker', 'soil', 'construction']",0.04326599121699493,Low
109,Photo by @stephenwilkes. ," Gliding through the Coast mountains, this Bald Eagle is the epitome of beauty found in nature.To see more photos from my travels near and far, visit me @stephenwilkes.  #DayToNight #StephenWilkes #CoastMountains #BaldEagle #Nature #Midflight #BellaCoola",285713,773,"['ecosystem', 'sky', 'vertebrate', 'bird', 'mountain', 'mountain range', 'bird of prey', 'condor', 'biome', 'flight']",0.0786398261061735,Low
110,Photo by @pedromcbride (Pete McBride) ," Silence is more memorable than the views. ÛÏThe brush of bat wings in the morning over your head. The clatter of sheep hooves on the rock across the river. It sounds as if itÛªs close by, but itÛªs not,Û says McBride. ÛÏAnd then you realize just how quickly that silence can be shattered."" From the latest @natgeo interview about my new book on the Grand Canyon. To read more or learn more, follow @pedromcbride #grandcanyon #betweenriverandrim #silence #humility #petemcbride",487715,947,"['sky', 'badlands', 'wilderness', 'cloud', 'horizon', 'geological phenomenon', 'national park', 'atmosphere', 'rock', 'canyon']",0.13210257280591423,High
111,Photo by @TimLaman ," Autumn sunrise, Walden Pond.  Photographed from Thoreau Cove, the part of the pond closest to Henry David ThoreauÛªs famous cabin where he did a lot of his thoughtful writing about the importance of our connection to nature.  Is it time re-read Thoreau? #Thoreau, #HenryDavidThoreau, #WaldenPond, #Concord, #Massachusetts, #autumn, #NewEngland.",459015,950,"['nature', 'autumn', 'leaf', 'tree', 'branch', 'sky', 'deciduous', 'sunlight', 'maple leaf', 'morning']",0.1246656874646096,High
112,Photo by @simonnorfolkstudio ," Sasso Barisano, The City of Matera, Basilicata, Italy. Known as ""la CittÌÊ Sotterranea"" (the Subterranean City), the city is centred on the ""Sassi di Matera"" (meaning ""The Stones of Matera""). The Sassi originate from a prehistoric troglodyte settlement, and are suspected to be some of the first human settlements in Italy, Indeed, Matera is the only place in the world where people can boast to be still living in the same houses of their ancestors of 9,000 years ago. Miserably poor throughout the centuries, and a burden on the national psyche, the Sassi were forcibly cleared in the 1950s, but in recent years have seen the return of tourists, boutique hotels and Hollywood film crews.  Matera is European Capital of Culture for 2019.Follow @simonnorfolkstudio  for updates, outtakes, unpublished and archive material.@simonnorfolkstudio @natgeo #photojournalism #documentaryphotography #simonnorfolk #worldmonuments #archaeology #matera #italy #prehistoric #unesco #renovation #restoration #conservation #caves #cavedwellers #history #worldheritage #heritage  #simonnorfolkstudio #Sassi",453881,1165,"['landmark', 'town', 'urban area', 'historic site', 'city', 'ancient history', 'history', 'neighbourhood', 'residential area', 'village']",0.12456529619872848,High
113,Photo by @amivitale ," It is devastating to hear that China has decided to reverse its 25-year-old ban on the sale and use of rhinoceros and tiger products. The reversal allows for these products to be used in medical research or healing, uses long since proven to have no benefits to humans. This change will certainly lead to more pressure on already terribly vulnerable animal populations and place in greater danger the conservationists, rangers and communities who fight for the survival of these majestic creatures. Here, Sudan, the last living male Northern White Rhino left on this planet is comforted moments before he passed away March 19, 2018 in northern Kenya. Sudan was brought to Kenya from @safari_park_dvur_kralove in the #Czechrepublic in 2009. He died surrounded by people who loved him at @olpejeta and has been an inspirational figure for many across the world. If there is any meaning in his death, its that Sudan can be our final wake up call. In a world of 7 billion, we need to start recognizing that we are not separate from nature. When we see ourselves as part of the landscape and part of nature, then saving nature is really about saving ourselves.Today, fewer 30,000 rhinos and 3,900 tigers remain in the wild. We are witnessing extinction on our watch and must help them by speaking out and supporting conservation efforts worldwide, especially among the indigenous communities who are on the front lines every day against poaching. Follow @olpejeta @safari_park_dvur_kralove @conservationorg @nature_africa and others to learn more and get involved. @kenyawildlifeservice @thephotosociety @natgeo @natgeoimagecollection #LastManStanding #SudanForever #WorthMoreAlive #OlPejetaRhinos #NorthernWhiteRhinos #protectrhinos #DontLetThemDisappear #rhinos #saverhinos #stoppoaching #kenya #northernkenya #africa #everydayafrica #photojournalism #amivitale",427570,5394,"['mammal', 'horn', 'fauna', 'wildlife', 'grass', 'snout', 'soil', 'elephant', 'tree', 'rhinoceros']",0.14198517615775716,High
114,Photo by @geosteinmetz ," Majiek Gai Chan, 15, lies on the ground after being cut with the knife that will mark him as a man in #Nuer society.  This ancient custom was once common throughout #SouthSudan, but has become increasingly rare as youth choose to keep their tribal identity more private and become socially accepted in the modern world.  The boys are cut in birth order, and were all eager to follow the tradition of their people.  Shortly after the cutting, one proud father sacrificed a cow to celebrate the manhood of his first son, and shared the meat with the village.  #anthropology in the 21st Century. To see more follow @geosteinmetz",384784,6043,"['face', 'person', 'head', 'eye', 'girl', 'water', 'human', 'temple', 'mouth', 'organ']",0.1345946493787753,High
115,Photo by @enricsala ," The planet is in a conservation crisis. We have killed 90 percent of the large fish in the ocean since 1900, and terrestrial vertebrates have declined by 60% since 1970. But there's still time to protect and restore the health of our natural world. Protected areas can bring wildlife back, and help give us oxygen, clean water, and mitigate climate change. That's why we're proud to work with the Wyss Campaign for Nature to help conserve 30% of our planet's waters and lands by 2030. Visit wysscampaign.org to learn more @insidenatgeo @natgeopristineseas",431085,1218,"['fish', 'marine biology', 'underwater', 'organism', 'water', 'marine mammal', 'computer wallpaper', 'turquoise', 'stock photography']",0.11894857580805675,High
116,Photo by @stephenwilkes ," The moon hovers in perfect symmetry with the Coast Mountains in Bella Coola. To see more photos from my travels near and far, visit me @stephenwilkes.#DayToNight #StephenWilkes #BellaCoola #Aerialphotography #Moon #Cloudscape #Surreal",296935,583,"['sky', 'mountainous landforms', 'mountain', 'mountain range', 'cloud', 'mount scenery', 'glacial landform', 'arctic', 'daytime', 'nunatak']",0.08046479558594286,Low
